{
  "id": "biopeptics-ghk-cu-blend-70mg",
  "schema_version": "1.0.0",
  "compound_id": "ghk-cu",
  "provider_id": "biopeptics",
  "product_url": "https://biopeptics.co.za/product/glow-blend-70-mg-ghk-cu-bpc-157-tb-500",
  "title_on_page": "Glow Blend – 70 mg (GHK-CU + BPC-157 + TB-500)",
  "form": "blend",
  "route": "injectable_subq",
  "strength": "70 mg",
  "pack_size": "GHK-Cu 50 mg, TB-500 10 mg, BPC-157 10 mg",
  "price_zar": 2200,
  "price_checked_on": "2026-08-26",
  "price_visible_without_login": true,
  "in_stock": true,
  "coa_stated": false,
  "coa_url": null,
  "coa_checked_on": null,
  "blend_compound_ids": [
    "ghk-cu",
    "bpc-157",
    "tb-500"
  ],
  "vendor_claim_quote": "Glow Blend is supplied in sterile lyophilized (freeze-dried) form for enhanced peptide stability and long-term research integrity during laboratory handling and experimental applications.",
  "last_reviewed_at": "2026-08-26",
  "reviewer": "grok",
  "sources": [
    {
      "url": "https://biopeptics.co.za/product/glow-blend-70-mg-ghk-cu-bpc-157-tb-500",
      "title": "Glow Blend – 70 mg (GHK-CU + BPC-157 + TB-500)",
      "accessed_at": "2026-08-26",
      "kind": "vendor",
      "quote": "For Research Use Only. Page stated In stock."
    }
  ],
  "confidence": "seen_live"
}
