{
  "id": "tetratide-labs-ghk-cu-lyophilized-vial-100mg-pen-kit",
  "schema_version": "1.0.0",
  "compound_id": "ghk-cu",
  "provider_id": "tetratide-labs",
  "product_url": "https://www.tetratidelabs.co.za/product-page/ghk-cu-100mg-precision-pen-kit",
  "title_on_page": "GHK-Cu Skin Glow 100mg Reusable Pen Kit",
  "form": "lyophilized_vial",
  "route": "injectable_subq",
  "strength": "100 mg",
  "pack_size": "100 mg lyophilised peptide, reusable precision pen, sterile cartridge, reconstitution kit",
  "price_zar": 1090,
  "price_checked_on": "2026-08-26",
  "price_visible_without_login": true,
  "in_stock": null,
  "coa_stated": false,
  "coa_url": null,
  "coa_checked_on": null,
  "blend_compound_ids": [],
  "vendor_claim_quote": "The Tetratide Labs Reusable GHK-Cu Kit combines a high-strength 100 mg vial with a reusable precision pen, sterile cartridge and complete reconstitution kit.",
  "last_reviewed_at": "2026-08-26",
  "reviewer": "grok",
  "sources": [
    {
      "url": "https://www.tetratidelabs.co.za/product-page/ghk-cu-100mg-precision-pen-kit",
      "title": "GHK-Cu Skin Glow 100mg Reusable Pen Kit",
      "accessed_at": "2026-08-26",
      "kind": "vendor"
    }
  ],
  "confidence": "seen_live"
}
