{
  "id": "the-clinic-tb-500-cartridge-10mg",
  "schema_version": "1.0.0",
  "compound_id": "tb-500",
  "provider_id": "the-clinic",
  "product_url": "https://www.the-clinic.co.za/shop/TB-500",
  "title_on_page": "TB-500 (Thymosin Beta-4) – 10mg",
  "form": "cartridge",
  "route": "injectable_subq",
  "strength": "10 mg",
  "pack_size": "2 mL",
  "price_zar": null,
  "price_checked_on": null,
  "price_visible_without_login": false,
  "in_stock": true,
  "coa_stated": false,
  "coa_url": null,
  "coa_checked_on": null,
  "blend_compound_ids": [],
  "vendor_claim_quote": "Supplied as a 10 mg cartridge in 2 mL, it provides a ready-to-use format for precise click-based dosing.",
  "last_reviewed_at": "2026-08-26",
  "reviewer": "grok",
  "sources": [
    {
      "url": "https://www.the-clinic.co.za/shop/TB-500",
      "title": "TB-500 (Thymosin Beta-4) – 10mg",
      "accessed_at": "2026-08-26",
      "kind": "vendor",
      "quote": "Availability: In Stock. Price not shown without login."
    }
  ],
  "confidence": "seen_live"
}
