{
  "id": "biopeptics-ghk-cu-lyophilized-vial-100mg",
  "schema_version": "1.0.0",
  "compound_id": "ghk-cu",
  "provider_id": "biopeptics",
  "product_url": "https://biopeptics.co.za/product/ghk-cu-copper-peptide-100-mg",
  "title_on_page": "GHK-CU – 100mg (Copper Peptide)",
  "form": "lyophilized_vial",
  "route": "injectable_subq",
  "strength": "100 mg",
  "pack_size": null,
  "price_zar": 1300,
  "price_checked_on": "2026-08-26",
  "price_visible_without_login": true,
  "in_stock": true,
  "coa_stated": false,
  "coa_url": null,
  "coa_checked_on": null,
  "blend_compound_ids": [],
  "vendor_claim_quote": "At BioPeptics, GHK-Cu is supplied in sterile lyophilized vial form for enhanced peptide stability and is independently third-party tested for identity and purity verification.",
  "last_reviewed_at": "2026-08-26",
  "reviewer": "grok",
  "sources": [
    {
      "url": "https://biopeptics.co.za/product/ghk-cu-copper-peptide-100-mg",
      "title": "GHK-CU – 100mg (Copper Peptide)",
      "accessed_at": "2026-08-26",
      "kind": "vendor",
      "quote": "For Research Use Only. Page stated In stock."
    }
  ],
  "confidence": "seen_live"
}
