{
  "id": "biopeptics-bpc-157-lyophilized-vial-10mg",
  "schema_version": "1.0.0",
  "compound_id": "bpc-157",
  "provider_id": "biopeptics",
  "product_url": "https://biopeptics.co.za/product/bpc-157-10-mg-body-protection-compound-157",
  "title_on_page": "BPC-157 – 10 mg (Body Protection Compound-157)",
  "form": "lyophilized_vial",
  "route": "injectable_subq",
  "strength": "10 mg",
  "pack_size": null,
  "price_zar": 1000,
  "price_checked_on": "2026-08-26",
  "price_visible_without_login": true,
  "in_stock": true,
  "coa_stated": false,
  "coa_url": null,
  "coa_checked_on": null,
  "blend_compound_ids": [],
  "vendor_claim_quote": "At BioPeptics, BPC-157 is supplied in sterile lyophilized (freeze-dried) powder form for enhanced peptide stability, purity, and long-term research integrity during laboratory handling and experimental applications.",
  "last_reviewed_at": "2026-08-26",
  "reviewer": "grok",
  "sources": [
    {
      "url": "https://biopeptics.co.za/product/bpc-157-10-mg-body-protection-compound-157",
      "title": "BPC-157 – 10 mg (Body Protection Compound-157)",
      "accessed_at": "2026-08-26",
      "kind": "vendor",
      "quote": "For Research Use Only. Page stated In stock."
    }
  ],
  "confidence": "seen_live"
}
